Script started on Tue 30 Oct 2018 07:00:21 PM EDT
]0;lyn@XPS15: ~/Desktoplyn@XPS15:~/Desktop$ sql [Kplus

SQL*Plus: Release 11.2.0.2.0 Production on Tue Oct 30 19:00:24 2018

Copyright (c) 1982, 2011, Oracle.  All rights reserved.

Enter user-name: instagramlol
Enter password: 

Connected to:
Oracle Database 11g Express Edition Release 11.2.0.2.0 - 64bit Production

SQL> insert into airport  
  2  values('YTT', 'Tintin Airport', 'Tintin', 'ON');

1 row created.

SQL> select * from airport;

AIRPORT_CODE	NAME
--------------- --------------------------------------------------
CITY						   STATE
-------------------------------------------------- ---------------
YYZ		Pearson Airport
Toronto 					   ON

YTZ		Island Airport
Toronto 					   ON

YQT		Thunder Bay Airport
Thunder Bay					   ON


AIRPORT_CODE	NAME
--------------- --------------------------------------------------
CITY						   STATE
-------------------------------------------------- ---------------
YQG		Windsor Airport
Windsor 					   ON

YYC		Calgary Airport
Calgary 					   ON

YTT		Tintin Airport
Tintin						   ON


6 rows selected.

SQL> update seat_reservation  
  2  set customer_phone='519-253-4001'
  3  where customer_name='Tony Appa';

2 rows updated.

SQL> select * from seat_reservation;

FLIGHT_NUMBER	LEG_NUMBER FDATE	      SEAT_NUMBER
--------------- ---------- ------------------ ---------------
CUSTOMER_NAME					   CUSTOMER_PHONE
-------------------------------------------------- --------------------
WJ250			 1 17-JAN-15	      20A
Mariane Mooer					   519-253-3000

WJ250			 2 17-JAN-15	      13D
Mariane Mooer					   519-253-3000

WJ250			 1 17-JAN-15	      6A
Tony Appa					   519-253-4001


FLIGHT_NUMBER	LEG_NUMBER FDATE	      SEAT_NUMBER
--------------- ---------- ------------------ ---------------
CUSTOMER_NAME					   CUSTOMER_PHONE
-------------------------------------------------- --------------------
WJ250			 2 17-JAN-15	      7D
Tony Appa					   519-253-4001

WJ250			 1 17-JAN-15	      6B
Karen Appa					   226-253-4000

WJ250			 2 17-JAN-15	      7C
Karen Appa					   226-253-4000


FLIGHT_NUMBER	LEG_NUMBER FDATE	      SEAT_NUMBER
--------------- ---------- ------------------ ---------------
CUSTOMER_NAME					   CUSTOMER_PHONE
-------------------------------------------------- --------------------
AC275			 1 17-JAN-10	      5C
Mark Black					   226-212-5341

AC275			 2 17-JAN-10	      14B
Mark Black					   226-212-5341

PA233			 1 17-JAN-30	      5A
Peter Opo					   519-444-1234


FLIGHT_NUMBER	LEG_NUMBER FDATE	      SEAT_NUMBER
--------------- ---------- ------------------ ---------------
CUSTOMER_NAME					   CUSTOMER_PHONE
-------------------------------------------------- --------------------
PA280			 1 17-JAN-20	      16D
Chris Natta					   226-123-5555


10 rows selected.

SQL> insert into flight
  2  values('AC331', 'Air Canada', 2);

1 row created.

SQL> select * from flight;

FLIGHT_NUMBER	AIRLINE 					     WEEKDAYS
--------------- -------------------------------------------------- ----------
WJ250		WestJet 						    3
WJ261		WestJet 						    4
AC275		Air Canada						    2
AC300		Air Canada						    3
AC320		Air Canada						    2
PA233		Porter Airline						    5
PA280		Porter Airline						    4
AC331		Air Canada						    2

8 rows selected.

SQL> delete from seat_reservation
  2  where customer_name='Mariane Mooer';

2 rows deleted.

SQL> select *f  from seat_reservation;

FLIGHT_NUMBER	LEG_NUMBER FDATE	      SEAT_NUMBER
--------------- ---------- ------------------ ---------------
CUSTOMER_NAME					   CUSTOMER_PHONE
-------------------------------------------------- --------------------
WJ250			 1 17-JAN-15	      6A
Tony Appa					   519-253-4001

WJ250			 2 17-JAN-15	      7D
Tony Appa					   519-253-4001

WJ250			 1 17-JAN-15	      6B
Karen Appa					   226-253-4000


FLIGHT_NUMBER	LEG_NUMBER FDATE	      SEAT_NUMBER
--------------- ---------- ------------------ ---------------
CUSTOMER_NAME					   CUSTOMER_PHONE
-------------------------------------------------- --------------------
WJ250			 2 17-JAN-15	      7C
Karen Appa					   226-253-4000

AC275			 1 17-JAN-10	      5C
Mark Black					   226-212-5341

AC275			 2 17-JAN-10	      14B
Mark Black					   226-212-5341


FLIGHT_NUMBER	LEG_NUMBER FDATE	      SEAT_NUMBER
--------------- ---------- ------------------ ---------------
CUSTOMER_NAME					   CUSTOMER_PHONE
-------------------------------------------------- --------------------
PA233			 1 17-JAN-30	      5A
Peter Opo					   519-444-1234

PA280			 1 17-JAN-20	      16D
Chris Natta					   226-123-5555


8 rows selected.

SQL> exit
Disconnected from Oracle Database 11g Express Edition Release 11.2.0.2.0 - 64bit Production
]0;lyn@XPS15: ~/Desktoplyn@XPS15:~/Desktop$ exit
exit

Script done on Tue 30 Oct 2018 07:04:36 PM EDT
